{
  "architecture_id": "ARCH-S0-RETAIN-SCAFFOLD-ONLY",
  "purpose": "Retain the current scaffold as a minimum-complexity baseline.",
  "component_placement": {"accepted-versus-done-workflow-state":"external specification only","claim-evidence-support-gate":"external specification only","hash-bound-reproducibility-manifest":"external specification only","leakage-safe-model-comparison-gate":"external specification only"},
  "formal_skill_count": 1,
  "state_truth_sources": ["state/project_state.json"],
  "deterministic_modules": [],
  "agent_modules": ["general Codex capability"],
  "data_flow": ["existing workflow only"],
  "state_flow": ["main agent writes existing state"],
  "failure_flow": ["existing fail-closed workflow"],
  "stale_flow": ["existing STALE rules"],
  "security_boundary": ["no third-party execution", "one formal Skill"],
  "implementation_surface": [],
  "maintenance_surface": ["existing scaffold"],
  "estimated_complexity": "MINIMAL",
  "expected_benefits": ["lowest maintenance"],
  "expected_costs": ["four gaps remain unimplemented"],
  "falsification_conditions": ["fails hard-safety threshold", "fails target-effectiveness threshold"],
  "public_tests": ["ARCH-PUB-S0"],
  "hidden_tests": ["ARCH-HID-S0"],
  "prototype_scope": "EXPERIMENTAL_SHADOW_PROTOTYPE_ONLY",
  "prohibited_behavior": ["selection", "formal integration", "second Skill", "second state truth"]
}
